[
  {
    "evidence_id": "EV-3DS-001",
    "verified_confidence": "중",
    "verification_reason": "IR·공시(SEC 8-K) 1차 유형이나 SEC 사이트 403으로 원문 직접 페치 실패, WebSearch가 반환한 8-K 요약으로만 확인. 발행일도 추정.",
    "source_tier": "1차",
    "recency_ok": true,
    "corroboration_count": 2,
    "issues": [
      "원문접근불가"
    ],
    "verdict": "accept"
  },
  {
    "evidence_id": "EV-3DS-002",
    "verified_confidence": "중",
    "verification_reason": "주요언론(Med-Tech Insights) 2차 출처 + 발췌, 헬스케어 실적·인증 구조적 사실이나 단일 2차 출처.",
    "source_tier": "2차",
    "recency_ok": true,
    "corroboration_count": 1,
    "issues": [
      "없음"
    ],
    "verdict": "accept"
  },
  {
    "evidence_id": "EV-3DS-003",
    "verified_confidence": "상",
    "verification_reason": "공식 보도자료 1차 출처 + 발췌, 콜라겐을 스캐폴드 원료로 하는 Print to Perfusion 공정(Collagen 아이템 직접 연관) 구조적 사실.",
    "source_tier": "1차",
    "recency_ok": true,
    "corroboration_count": 2,
    "issues": [
      "없음"
    ],
    "verdict": "accept"
  },
  {
    "evidence_id": "EV-3DS-004",
    "verified_confidence": "상",
    "verification_reason": "IR·공시(GlobeNewswire) 1차 출처 + 발췌, Systemic Bio 설립·h-VIOS 플랫폼 구조적 사실.",
    "source_tier": "1차",
    "recency_ok": true,
    "corroboration_count": 2,
    "issues": [
      "없음"
    ],
    "verdict": "accept"
  },
  {
    "evidence_id": "EV-3DS-005",
    "verified_confidence": "중",
    "verification_reason": "주요언론 2차 출처이나 3개 독립매체(3DPI, 3DPrint.com, 3D ADEPT) 교차확인. 뉴스·동향 12개월 이내로 최신성 충족.",
    "source_tier": "2차",
    "recency_ok": true,
    "corroboration_count": 2,
    "issues": [
      "없음"
    ],
    "verdict": "accept"
  },
  {
    "evidence_id": "EV-3DS-006",
    "verified_confidence": "중",
    "verification_reason": "주요언론 2차 출처 + TISSIUM 공식보도·다수 매체 교차확인된 FDA De Novo 사실이나 뉴스·동향 발행일(2025-06-24)이 12개월 창을 근소하게 초과.",
    "source_tier": "2차",
    "recency_ok": false,
    "corroboration_count": 2,
    "issues": [
      "없음"
    ],
    "verdict": "accept"
  },
  {
    "evidence_id": "EV-3DS-007",
    "verified_confidence": "하",
    "verification_reason": "특허 1차 유형이나 3D Systems 명의 콜라겐 바이오프린팅 등록특허 번호를 공개DB에서 특정 실패(관련 특허는 타 재단 귀속). 발행일 미상·inconclusive. 다만 3DS의 Collagen 연관은 파트너십(008/009)·Print to Perfusion(003)으로 확립되어 아이템 판정을 좌우하는 하중 큰 사실 아님 → accept(하).",
    "source_tier": "1차",
    "recency_ok": false,
    "corroboration_count": 1,
    "issues": [
      "없음"
    ],
    "verdict": "accept"
  },
  {
    "evidence_id": "EV-3DS-008",
    "verified_confidence": "상",
    "verification_reason": "공식 보도자료 1차 출처 + 발췌, CollPlant rhCollagen 바이오잉크 공동개발(Collagen 직접 연관 강근거). 2020 JDA + 2021 유방재건 교차확인.",
    "source_tier": "1차",
    "recency_ok": true,
    "corroboration_count": 2,
    "issues": [
      "없음"
    ],
    "verdict": "accept"
  },
  {
    "evidence_id": "EV-3DS-009",
    "verified_confidence": "상",
    "verification_reason": "IR·공시(United Therapeutics IR) 1차 출처 + 발췌, rhCollagen 폐 스캐폴드 협업·CollPlant 라이선스 구조적 사실. 다중 교차참조.",
    "source_tier": "1차",
    "recency_ok": true,
    "corroboration_count": 3,
    "issues": [
      "없음"
    ],
    "verdict": "accept"
  },
  {
    "evidence_id": "EV-3DS-010",
    "verified_confidence": "중",
    "verification_reason": "주요언론(Med-Tech Insights) 2차 출처 + 발췌, TISSIUM 공동개발 구조적 사실. 단일 2차 출처.",
    "source_tier": "2차",
    "recency_ok": true,
    "corroboration_count": 2,
    "issues": [
      "없음"
    ],
    "verdict": "accept"
  },
  {
    "evidence_id": "EV-3DS-011",
    "verified_confidence": "하",
    "verification_reason": "논문 1차 유형이나 3DS-특정 아닌 일반 TG-콜라겐 문헌으로 3DS의 mTG 채택 근거 무발견(추론적 negative). 다만 3DS 대표공정이 광중합(003)임이 확립되어 mTG 무관 결론은 보강되며, 단독으로 아이템 판정 좌우하는 하중 큰 사실 아님 → accept(하).",
    "source_tier": "1차",
    "recency_ok": true,
    "corroboration_count": 2,
    "issues": [
      "추론과다"
    ],
    "verdict": "accept"
  },
  {
    "evidence_id": "EV-3DS-012",
    "verified_confidence": "하",
    "verification_reason": "ADC 부재 negative finding으로 출처유형 기타(미확인)·검색 무발견·발행일 미상. 3DS는 3D프린팅·재생의학 기업으로 ADC 무관이 명백한 배경정보 → accept(하).",
    "source_tier": "미확인",
    "recency_ok": false,
    "corroboration_count": 1,
    "issues": [
      "추론과다"
    ],
    "verdict": "accept"
  },
  {
    "evidence_id": "EV-ABM-001",
    "verified_confidence": "중",
    "verification_reason": "주요언론(SDBJ) 기반 2차 출처이나 회사소개·언론이 일치하고 다수 교차확인된 구조적 사업 사실. 1차 공식출처가 아니어서 상은 아님.",
    "source_tier": "2차",
    "recency_ok": true,
    "corroboration_count": 3,
    "issues": [
      "없음"
    ],
    "verdict": "accept"
  },
  {
    "evidence_id": "EV-ABM-002",
    "verified_confidence": "중",
    "verification_reason": "공식홈페이지 1차 출처이나 WebFetch 봇차단(403)으로 원문 미열람, 검색 스니펫으로만 확인되어 상 불가.",
    "source_tier": "1차",
    "recency_ok": false,
    "corroboration_count": 2,
    "issues": [
      "원문접근불가"
    ],
    "verdict": "accept"
  },
  {
    "evidence_id": "EV-ABM-003",
    "verified_confidence": "상",
    "verification_reason": "공식홈페이지 1차 출처 + 근거발췌 확보, 콜라겐 바이오잉크 직접 사업의 핵심 근거로 원문접근 이슈 없음.",
    "source_tier": "1차",
    "recency_ok": false,
    "corroboration_count": 2,
    "issues": [
      "없음"
    ],
    "verdict": "accept"
  },
  {
    "evidence_id": "EV-ABM-004",
    "verified_confidence": "상",
    "verification_reason": "공식홈페이지 1차 출처 + Sigma-Aldrich·Fisher 유통카탈로그로 교차확인된 기술 플랫폼 사실.",
    "source_tier": "1차",
    "recency_ok": false,
    "corroboration_count": 3,
    "issues": [
      "없음"
    ],
    "verdict": "accept"
  },
  {
    "evidence_id": "EV-ABM-005",
    "verified_confidence": "상",
    "verification_reason": "공식홈페이지 1차 출처 + 제품 발췌 확보, 가교시약 목록의 구조적 사실.",
    "source_tier": "1차",
    "recency_ok": false,
    "corroboration_count": 2,
    "issues": [
      "없음"
    ],
    "verdict": "accept"
  },
  {
    "evidence_id": "EV-ABM-006",
    "verified_confidence": "중",
    "verification_reason": "공식홈페이지 1차 출처이나 mTG는 교육/설명 맥락 언급일 뿐 제품·자체기술 채택 근거 아님(주제적 인접성만). self_confidence 중과 일치.",
    "source_tier": "1차",
    "recency_ok": false,
    "corroboration_count": 2,
    "issues": [
      "없음"
    ],
    "verdict": "accept"
  },
  {
    "evidence_id": "EV-ABM-007",
    "verified_confidence": "중",
    "verification_reason": "주요언론 2차 출처이나 SDBJ·BICO 두 출처 교차확인된 M&A 구조적 사실.",
    "source_tier": "2차",
    "recency_ok": true,
    "corroboration_count": 2,
    "issues": [
      "없음"
    ],
    "verdict": "accept"
  },
  {
    "evidence_id": "EV-ABM-008",
    "verified_confidence": "중",
    "verification_reason": "주요언론(News-Medical/Nanoscribe) 2차 출처, 원문접근 가능한 협업 발표 사실. 단일계열 보도로 상은 아님.",
    "source_tier": "2차",
    "recency_ok": true,
    "corroboration_count": 2,
    "issues": [
      "없음"
    ],
    "verdict": "accept"
  },
  {
    "evidence_id": "EV-ABM-009",
    "verified_confidence": "중",
    "verification_reason": "주요언론 2차 출처. 뉴스·동향 카드로 발행일(2024-05)이 12개월 창 밖이나 48개월 초과는 아님. honest_gap 명시.",
    "source_tier": "2차",
    "recency_ok": false,
    "corroboration_count": 2,
    "issues": [
      "없음"
    ],
    "verdict": "accept"
  },
  {
    "evidence_id": "EV-ABM-010",
    "verified_confidence": "상",
    "verification_reason": "등록특허(Google Patents) 1차 출처, 원문접근 가능 + Assignee·등록번호 발췌 확보. 콜라겐 직접 IP 근거.",
    "source_tier": "1차",
    "recency_ok": true,
    "corroboration_count": 2,
    "issues": [
      "없음"
    ],
    "verdict": "accept"
  },
  {
    "evidence_id": "EV-ABM-011",
    "verified_confidence": "중",
    "verification_reason": "ADC/mTG 부재를 확인하는 negative finding으로 출처유형 기타(미확인)·검색 무발견 기반의 추론적 성격. honest_gap 문서화됨. ABM의 핵심 아이템(Collagen)은 타 카드로 확립되어 좌우 사실 아님.",
    "source_tier": "미확인",
    "recency_ok": false,
    "corroboration_count": 2,
    "issues": [
      "추론과다"
    ],
    "verdict": "accept"
  },
  {
    "evidence_id": "EV-ALE-001",
    "verified_confidence": "상",
    "verification_reason": "공식 홈페이지(1차)+Wikipedia 교차, 원문 URL·발췌. 구조적 회사·제품 정체성 사실.",
    "source_tier": "1차",
    "recency_ok": true,
    "corroboration_count": 2,
    "issues": [
      "없음"
    ],
    "verdict": "accept"
  },
  {
    "evidence_id": "EV-ALE-002",
    "verified_confidence": "상",
    "verification_reason": "공식 홈페이지 'Our Recipe'(1차)+Green Matters·Lab Manager 교차. 스캐폴드가 대두/밀 식물단백이며 콜라겐 아님 = Collagen 아이템 연관 판정 근거.",
    "source_tier": "1차",
    "recency_ok": true,
    "corroboration_count": 2,
    "issues": [
      "없음"
    ],
    "verdict": "accept"
  },
  {
    "evidence_id": "EV-ALE-003",
    "verified_confidence": "상",
    "verification_reason": "Nature Food 논문 기반(source_type 논문·1차)+Lab Manager 교차, 원문 URL·발췌. Levenberg 원천기술.",
    "source_tier": "1차",
    "recency_ok": true,
    "corroboration_count": 2,
    "issues": [
      "없음"
    ],
    "verdict": "accept"
  },
  {
    "evidence_id": "EV-ALE-004",
    "verified_confidence": "중",
    "verification_reason": "Aleph 공식 보도자료(Businesswire, 2차/공식보도 인용)+vegconomist·Food Ingredients First 교차. 배양 콜라겐 플랫폼 = Collagen 아이템 직접 접점의 하중 큰 사실이나 발췌·교차 확보로 중 판정(하 아님).",
    "source_tier": "2차",
    "recency_ok": true,
    "corroboration_count": 2,
    "issues": [
      "없음"
    ],
    "verdict": "accept"
  },
  {
    "evidence_id": "EV-ALE-005",
    "verified_confidence": "중",
    "verification_reason": "FoodNavigator(2차)+Wiley 피어리뷰(2023)·3Dnatives 교차로 트랜스글루타미나제 사용 사실은 확실. mTG(미생물) 특정만 미확정(정직한 gap). mTG 아이템 응용 접점 근거로 하 아님.",
    "source_tier": "2차",
    "recency_ok": true,
    "corroboration_count": 2,
    "issues": [
      "없음"
    ],
    "verdict": "accept"
  },
  {
    "evidence_id": "EV-ALE-006",
    "verified_confidence": "상",
    "verification_reason": "특허 US20200140810A1(1차)+원문 URL+발췌. 스캐폴드는 텍스처 대두단백, 응고제는 thrombin/fibrin으로 콜라겐·TG 스캐폴드 미명시.",
    "source_tier": "1차",
    "recency_ok": true,
    "corroboration_count": 1,
    "issues": [
      "없음"
    ],
    "verdict": "accept"
  },
  {
    "evidence_id": "EV-ALE-007",
    "verified_confidence": "중",
    "verification_reason": "ABA Landslide 특허지형 리포트(2차) 발췌에 'cell-free animal collagen' 직접 언급, EV-ALE-004 보도자료 교차. 구체 콜라겐 특허번호는 미확보(honest_gap)이나 콜라겐 특허 존재 자체는 확인.",
    "source_tier": "2차",
    "recency_ok": true,
    "corroboration_count": 2,
    "issues": [
      "없음"
    ],
    "verdict": "accept"
  },
  {